{
  "$schema": "https://json-schema.org/draft/2020-12/schema",
  "type": "object",
  "additionalProperties": false,
  "required": [
    "title",
    "subtitle",
    "description",
    "footer"
  ],
  "properties": {
    "title": {
      "type": "string",
      "minLength": 1
    },
    "subtitle": {
      "type": "string"
    },
    "description": {
      "type": "string"
    },
    "footer": {
      "type": "string"
    },
    "variants": {
      "type": "object",
      "description": "Optional overrides keyed by registered template name",
      "additionalProperties": {
        "type": "object",
        "minProperties": 1,
        "additionalProperties": false,
        "properties": {
          "title": {
            "type": "string",
            "minLength": 1
          },
          "subtitle": {
            "type": "string"
          },
          "description": {
            "type": "string"
          },
          "footer": {
            "type": "string"
          },
          "category": {
            "type": "string"
          },
          "image": {
            "type": "string"
          },
          "source": {
            "type": "string"
          }
        }
      }
    },
    "category": {
      "type": "string"
    },
    "image": {
      "type": "string"
    },
    "source": {
      "type": "string"
    }
  }
}
